{
  "schema": "ee.mesh.peer_group_binding.v1",
  "workspaceId": "wsp_local_docs_001",
  "workspaceAlias": "local-docs",
  "peerGroupId": "pg_docs_metadata_001",
  "peerIds": ["peer_docs_peer_001"],
  "originWorkspaceIds": ["wsp_remote_docs_001"],
  "originWorkspaceAliases": {
    "wsp_remote_docs_001": "remote-docs"
  },
  "lanes": {
    "metadata": "allow",
    "body": "deny",
    "embedding": "deny",
    "graphLink": "deny",
    "revisionNotice": "allow",
    "curationSignal": "deny"
  },
  "defaultAction": "deny"
}
