{
  "schema": "ee.mesh.peer_group_binding.v1",
  "workspaceId": "wsp_local_curation_001",
  "workspaceAlias": "local-curation",
  "peerGroupId": "pg_curation_review_001",
  "peerIds": ["peer_reviewer_001"],
  "originWorkspaceIds": ["wsp_remote_curation_001", "wsp_remote_curation_002"],
  "originWorkspaceAliases": {
    "wsp_remote_curation_001": "remote-curation-a",
    "wsp_remote_curation_002": "remote-curation-b"
  },
  "lanes": {
    "metadata": "allow",
    "body": "quarantine",
    "embedding": "deny",
    "graphLink": "quarantine",
    "revisionNotice": "allow",
    "curationSignal": "quarantine"
  },
  "defaultAction": "deny"
}
